{
  "event_id": "aaaaaaaa-aaaa-4aaa-8aaa-aaaaaaaaaaaa",
  "event_type": "avf.generation.job_created",
  "aggregate_id": "job-88888888",
  "aggregate_version": 1,
  "timestamp_utc": "2026-08-16T12:00:00Z",
  "correlation_id": "bbbbbbbb-bbbb-4bbb-8bbb-bbbbbbbbbbbb",
  "trace_id": "0123456789abcdef0123456789abcdef",
  "span_id": "0123456789abcdef",
  "workflow_run_id": "wf-run-777",
  "schema_version": "1.0.0",
  "payload": {
    "job_id": "88888888-8888-4888-8888-888888888888",
    "project_id": "11111111-1111-4111-8111-111111111111",
    "provider_id": "google-flow-pro"
  }
}
